标题,总价（万）,单价,小区,区域,房间数,大小,朝向,建造时间,标签
天润城 街区 商品住宅 满五 南北通透,159,11621元/㎡,天润城第一街区,浦口,3,136.83㎡,南北,2012年建造,"['南北', '满五年', '近地铁', '绿化率高']"
幸福里街区 滨江馨园 91平大两房边户 南北通透 总价低,118,12968元/㎡,滨江馨园,浦口,2,91㎡,南北,2018年建造,"['南北', '满二年', '近地铁']"
绿洲南苑边户三房 吾悦广场旁 南北通透 价格可谈,95,10669元/㎡,绿洲南苑C区,雨花台,3,89.05㎡,南,2000年建造,"['南', '满二年']"
芳庭潘园 简装三房 中间楼层 采光很好 紧靠地铁口 配套成熟,98,10766元/㎡,芳庭潘园,六合,3,91.03㎡,南北,2015年建造,"['南北', '满二年', '近地铁', '户型方正']"
小市地铁口 精装修 双南全明 楼层好 看房有钥匙 换房诚心售,169,26826元/㎡,和燕园,鼓楼,2,63㎡,南,1998年建造,"['南', '满五年', '近地铁']"
溧水城南单价九千多精装小三房,95,10052元/㎡,佳兆业悦峰府,溧水,3,94.51㎡,南北,2020年建造,"['南北', '近地铁', '次新房']"
大光里壹中房龄新 可拎包入住两房 非顶楼采光视野好,195,37285元/㎡,大光里小区,秦淮,2,52.3㎡,南,1993年建造,"['南', '满五年', '近地铁']"
明发滨江新城(二期) 精装好房 商品房 南向采光好 临地铁,115,22550元/㎡,明发滨江新城(二期),浦口,1,51㎡,南,2013年建造,"['南', '满二年', '近地铁']"
精装修大两房 东边户 采光好 有落地窗 业主诚心出售,190,33334元/㎡,安康小区(建邺),建邺,2,57㎡,南北,1994年建造,"['南北', '近地铁']"
必卖，大桥下人气小区，精装80平2房，97万急售，双地铁环绕,97,12125元/㎡,桥北新村,浦口,2,80㎡,南北,2008年建造,"['南北', '满五年', '近地铁']"
燕禾园 纯商品房三楼 豪装急售,188,25027元/㎡,燕禾园,鼓楼,2,75.12㎡,南北,2007年建造,"['南北', '满五年', '近地铁']"
中央门小市 和燕园 边户客厅带窗 满五 看房随时地铁口,168,23334元/㎡,和燕园,鼓楼,2,72㎡,东西,1998年建造,"['东西', '近地铁']"
银城东苑 大院内 精装大三房 南北双阳台 看中价格好谈 急售,475,33245元/㎡,银城东苑,玄武,3,142.88㎡,南北,2006年建造,"['南北', '满二年', '近地铁']"
急 地铁口 燕子矶 燕江新城燕鸣苑 双南两房楼层佳 环境好,103,14469元/㎡,燕江新城燕鸣苑,栖霞,2,71.19㎡,南北,2019年建造,"['南北', '有电梯', '近地铁', '次新房']"
你给我18可得 年底特价就一套中 层 新空有钥匙,86,9556元/㎡,左所雅苑,浦口,2,90㎡,南,2017年建造,"['南', '有电梯', '近地铁']"
北阴阳营 云南路 上海路 北京西路 已出新全明 低总价诚心卖,128,23656元/㎡,北阴阳营10-16号小区,鼓楼,3,54.11㎡,东西,1990年建造,"['东西', '满五年', '近地铁', '车位充足']"
东虹花苑西苑 中间楼层采光好 板楼 南北通透 随时看,98,10538元/㎡,东虹花苑西苑,江宁,3,93㎡,南北,2008年建造,['南北']
核心区 一中旁 位置 改善大三房 南北通透 林景熙园,235,19125元/㎡,通宇林景熙园(一期),浦口,3,122.88㎡,南北,2018年建造,"['南北', '满二年', '车位充足']"
两房精装修 拎包入住156万60多平 急售 看房方便,156,24684元/㎡,双桥新村,秦淮,2,63.2㎡,南北,1990年建造,"['南北', '满五年', '近地铁']"
亚东城西区 78平好户型 好楼层 精装带墙暖,209,26659元/㎡,亚东城(西区),栖霞,2,78.4㎡,南,2009年建造,"['南', '满五年', '近地铁', '绿化率高']"
北四卫头3号小区 交通便利 满五 1楼带院 医疗配套成熟,182,29479元/㎡,北四卫头3号小区,鼓楼,2,61.74㎡,南北,1990年建造,"['南北', '满五年', '近地铁', '车位充足']"
临江锦园 板楼 中间好楼层 出行方便 次新房 大两居,108,12858元/㎡,临江锦园,浦口,2,84㎡,南北,2021年建造,"['南北', '有电梯', '次新房']"
新上板桥永安花苑顶楼带阁楼业主急售看中价格能谈有钥匙急售,80,9639元/㎡,永安花苑,雨花台,3,83㎡,南北,2008年建造,"['南北', '满五年']"
KFC旁 新民花苑 精装3房 采光好 有钥匙随时看 诚售可谈,90,9474元/㎡,新民花苑,滨江开发区,3,95㎡,南北,2012年建造,"['南北', '满五年']"
印悦府 大三房两厅两卫 好楼层精装修,270,23894元/㎡,印悦府,浦口,3,113㎡,南北,2020年建造,"['南北', '满二年', '近地铁', '次新房']"
急售冠城大通三期毛胚随意装紧邻地铁口高楼层视野开阔交通便利,102,10968元/㎡,冠城大通竹苑,六合,3,93㎡,南北,2017年建造,"['南北', '近地铁']"
扬子江隧道口 阳光帝景 新空毛坯 业主急售,180,14286元/㎡,阳光帝景,浦口,3,126㎡,南北,2017年建造,"['南北', '满五年']"
价格可大谈！出价就卖 随时看房 好楼层 飞机户型,280,21539元/㎡,万达茂御湖仕家三期,栖霞,4,130㎡,南北,2018年建造,"['南北', '满五年', '近地铁']"
买菜价！2w5单价买城东老牌 豪宅天泓山庄！360w诚意出,360,25306元/㎡,天泓山庄,栖霞,3,142.26㎡,南北,2009年建造,"['南北', '满五年', '近地铁', '绿化率高']"
明发滨江新城(一期) 南北通透大四居 三开间朝南 中间楼层,230,16789元/㎡,明发滨江新城(一期),浦口,4,137㎡,南北,2012年建造,"['南北', '满五年', '近地铁']"
集中供暖 超低密度 钥匙房 有电梯 满五 南北通透,639,36607元/㎡,钟山花园城博雅居,玄武,4,174.56㎡,南北,2003年建造,"['南北', '房东直卖', '满五年', '近地铁']"
绿洲南苑B区 南北通透 板楼 近地铁 小三房 商品房 装修好,85,9445元/㎡,绿洲南苑B区,雨花台,3,90㎡,南北,2017年建造,"['南北', '满二年', '人气热搜']"
次新小区 花园洋房 不一样的体验 高品质 香榭对面,280,26245元/㎡,大华锦绣城阅江山,浦口,4,106.69㎡,南北,2016年建造,"['南北', '满五年', '采光较好']"
急急急！商业中心！刚需2房！可改3房！房主急卖！,128,13914元/㎡,威尼斯水城第四街区,浦口,2,92㎡,南北,2008年建造,"['南北', '满五年', '近地铁', '车位充足']"
仙林双线地铁口 仙林国际花园 精装三房 拎包入住,66.5,7173元/㎡,仙林国际花园,南京周边,3,92.71㎡,南北,2019年建造,"['南北', '满二年', '次新房']"
急卖好房 好楼层 视野无遮挡 有电梯 客厅朝南 价格真实,149,15685元/㎡,瑞祥佳苑,江宁,2,95㎡,南北,2016年建造,"['南北', '满二年']"
裕民家园南京 大两房 采光好1楼不遮挡 价格好谈,79.8,9378元/㎡,裕民家园,浦口,2,85.1㎡,南北,2010年建造,"['南北', '满五年']"
九龙湖 殷巷 精装修 高楼层视野好 出行方便 临地铁,185,14567元/㎡,殷巷新寓,江宁,4,127㎡,南北,2010年建造,"['南北', '满二年', '近地铁']"
本周必卖，大学印象精装修 车位，家具家电全,68.1,7169元/㎡,碧桂园大学印象,南京周边,3,95㎡,南北,2018年建造,"['南北', '满五年', '车位充足', '采光较好']"
科利华 百子亭后 东升花苑 阳光好 中间楼层 无任何遮挡,270,53171元/㎡,百子亭后小区,玄武,2,50.78㎡,南北,1995年建造,"['南北', '满五年', '近地铁']"
带电梯 精装可拎包入住 满五 商业配套成熟 产权清晰,145,13181元/㎡,荣盛水景城天枢苑,六合,3,110.01㎡,南北,2012年建造,"['南北', '满五年', '近地铁']"
有个26万买地铁三号线柳州东路地铁口阳光好电梯南北通透三房,138,12213元/㎡,润泰花园二期,浦口,3,113㎡,南北,2017年建造,"['南北', '满二年', '近地铁']"
大新嘉苑 近地铁 出行方便 楼龄新 带电梯 小三房,135,15341元/㎡,大新嘉苑,浦口,3,88㎡,南北,2017年建造,"['南北', '有电梯']"
装修非常好，无遮挡拎包入住， 车位，充电桩,57.6,6598元/㎡,四季金辉,南京周边,3,87.31㎡,南北,2015年建造,"['南北', '满五年']"
朝南 医疗配套成熟 近地铁 大两居 满二 带电梯,198,14777元/㎡,世贸中心大厦,鼓楼,2,134㎡,南,2000年建造,"['南', '满二年', '近地铁', '多人关注']"
东虹花苑东屏苑 精装修 拎包入住 好楼层 首付二成 安家南京,160,14546元/㎡,东虹花苑东屏苑,江宁,3,110㎡,南北,2016年建造,"['南北', '满二年']"
地铁房 橡树城 精装满二 保养好 拎包入住 随时看房,79,6915元/㎡,橡树城,溧水,3,114.25㎡,南北,2018年建造,"['南北', '满二年', '近地铁']"
辰龙广场 银城汇文 满五年 诚售 随时看 电梯房 房龄新,270,50345元/㎡,辰龙广场,鼓楼,1,53.63㎡,南北,2003年建造,"['南北', '满五年', '近地铁']"
急售35米，精装修柏丽湾小三房,43,4523元/㎡,碧桂园凤凰城柏丽湾,南京周边,3,95.09㎡,南北,2016年建造,"['南北', '满二年']"
便宜房98平95万 为数不多的户型可做四房好楼层位置好有钥匙,95.8,9785元/㎡,亚泰梧桐世家,六合,3,97.91㎡,南北,2014年建造,"['南北', '满五年', '车位充足']"
板楼 临地铁 次新小区 电梯房 南北通透 高楼层视野无遮挡,102,11209元/㎡,珍珠园,浦口,2,91㎡,南北,2021年建造,"['南北', '满二年', '次新房']"
来电咨询 临地铁 环境好 中间楼层 采光好,189,17457元/㎡,江南青年城蓝水苑,江宁,3,108.27㎡,南北,2000年建造,"['南北', '满五年', '近地铁', '绿化率高']"
实地拍摄 保利紫晶山入户花园洋房 环境优美 3房2卫 好楼层,530,37272元/㎡,保利紫晶山,栖霞,3,142.2㎡,南北,2013年建造,"['南北', '满五年', '近地铁']"
精装修 实际面积大 储 看房方便,215,20834元/㎡,三新村,江宁,2,103.2㎡,南北,2004年建造,['南北']
降 降 降盆底价水榭花苑四小扬子一中电梯房中层落地阳台采光好,170,14050元/㎡,水榭花苑,六合,3,121㎡,南北,2005年建造,"['南北', '满五年', '近地铁']"
急急急 华府国际 大三房 新空毛坯 中间楼层 随时可看,260,18228元/㎡,华府国际,浦口,3,142.65㎡,南,2017年建造,"['南', '满五年']"
幕府山庄 购物方便 中间楼层采光好 正南朝向 近地铁,110,18645元/㎡,幕府山庄,栖霞,2,59㎡,南,2000年建造,"['南', '满五年', '近地铁']"
月牙湖畔 五号线 光华门 精装两房 全明 价格可谈 诚心卖,138,24473元/㎡,蓝旗新村(北区),秦淮,2,56.39㎡,南北,1989年建造,"['南北', '满五年', '近地铁']"
急售急售 绿洲南苑B区 中间楼层 价格可以小,98,10933元/㎡,绿洲南苑B区,雨花台,3,89.64㎡,南北,2015年建造,['南北']
润泰花园二期 板楼 满五 交通便利 商品房 配套齐全,84,10371元/㎡,润泰花园二期,浦口,2,81㎡,南北,2007年建造,"['南北', '满五年', '近地铁', '多人关注']"
急售高科荣境 精装修 临地铁 电梯房 商品住宅 次新小区,570,31928元/㎡,高科荣境2期,栖霞,4,178.53㎡,南北,2020年建造,"['南北', '满五年', '近地铁', '次新房']"
议价30万！ 三楼 双南精装修大两房 我有底价,150,23311元/㎡,庆盛园小区,秦淮,2,64.35㎡,南北,2000年建造,"['南北', '满五年', '户型方正']"
婚装 采光好 中间楼层 小区出新,200,28873元/㎡,旭光里小区,秦淮,2,69.27㎡,南,1992年建造,"['南', '满二年', '近地铁']"
6号线地铁口 南林大隔壁财大小区花园路15号 诚心卖,170,16662元/㎡,花园路15号小区,玄武,3,102.03㎡,南北,2000年建造,"['南北', '唯一住房', '近地铁']"
新城花漾紫郡 南北通透 小三居 高楼层视野好 有电梯 临地铁,125,16084元/㎡,新城花漾紫郡,浦口,3,77.72㎡,南北,2018年建造,"['南北', '满二年', '近地铁']"
海德北岸城 满五 购物方便 电梯房 楼层好 装修好,122,15483元/㎡,海德北岸城,浦口,2,78.8㎡,南北,2012年建造,"['南北', '有电梯', '近地铁']"
新上梅山绿洲南苑业主换房急售南北全明采光刺眼有钥匙急售,90,10000元/㎡,绿洲南苑C区,雨花台,3,90㎡,南北,2008年建造,"['南北', '满二年']"
莺歌苑，南北通，采光好，交通便利，随时看房。,189,28680元/㎡,莺歌苑小区,建邺,2,65.9㎡,南北,2000年建造,"['南北', '满五年', '近地铁', '车位充足']"
红山地铁口 复地新都国际 一梯一户 不临街 小高层 双阳台,525,40157元/㎡,复地新都国际(北区),鼓楼,4,130.74㎡,南北,2018年建造,"['南北', '满五年', '近地铁']"
买一层得一层 大露台 90平128万可谈 诚心售 万江天和苑,128,14054元/㎡,万江共和新城天和苑(东区),浦口,4,91.08㎡,南北,2010年建造,"['南北', '房东直卖', '满五年', '车位充足']"
商品房 中间楼层 现房 有电梯 小区环境好 近 急售！！,77,8631元/㎡,万科未来城,溧水,3,89.22㎡,南北,2020年建造,"['南北', '满二年', '近地铁', '车位充足']"
报价急降40万 外地换房急售 满五 楼下地铁只要50米,130,11903元/㎡,润泰花园二期,浦口,3,109.22㎡,南北,2018年建造,"['南北', '近地铁', '采光较好', '多人关注']"
一七号双地铁 晓庄地铁口 晓庄村小区 伯乐 全明边户即看,200,17478元/㎡,晓庄村42号院,栖霞,3,114.43㎡,南北,1999年建造,"['南北', '满五年', '近地铁', '车位充足']"
不靠高速 价格可大刀 空间有惊喜 电梯4房 婚装保养新 钥匙,300,18750元/㎡,翠屏东南,江宁,4,160㎡,南北,2010年建造,"['南北', '满五年', '近地铁', '多人关注']"
融侨观邸旁 揽月山庄 三房 好楼层 总价低 户型方正 随时看,155,15500元/㎡,揽月山庄,浦口,3,100㎡,南北,2005年建造,"['南北', '满二年', '近地铁']"
龙池 车位充足 中间楼层采光好 次新小区 满二 高绿化,67,7583元/㎡,中岛花园,六合,2,88.36㎡,南北,2022年建造,"['南北', '房东直卖', '满二年', '绿化率高']"
宝隆时代 单价1万可谈 10套特价 可谈 装修 急,53,10012元/㎡,宝隆时代广场,浦口,2,52.94㎡,南,2018年建造,"['南', '满五年', '近地铁']"
必看好房 地铁口 精装大三房 三开间朝南户型 恒大金碧天下,63,4961元/㎡,恒大金碧天下,溧水,3,127㎡,南北,2019年建造,"['南北', '有电梯', '次新房', '户型方正']"
铁心桥近S3地铁 翠岭银河2房 南北通透 高楼层视野好,136,17663元/㎡,翠岭银河,雨花台,2,77㎡,南北,2009年建造,"['南北', '满二年', '近地铁', '绿化率高']"
蓝光公园壹号 板楼 小三居 正规商品房 南北通透 双卫格局,210,19281元/㎡,蓝光公园壹号,雨花台,3,108.92㎡,南北,2015年建造,"['南北', '车位充足']"
0.5可以做 不站 3楼 天目路 玉泉路 琅琊路 灵隐路,430,75705元/㎡,玉泉路6号小区,鼓楼,2,56.8㎡,南北,2018年建造,"['南北', '满五年', '近地铁', '车位充足']"
临江锦园 次新小区 交通便捷 南北通透 中间楼层采光好,100,14085元/㎡,临江锦园,浦口,2,71㎡,南北,2022年建造,"['南北', '有电梯', '次新房']"
招商兰溪谷(二期) 近地铁 南北通透 产权清晰 楼龄新,229,19084元/㎡,招商兰溪谷(二期),浦口,4,120㎡,南北,2017年建造,"['南北', '满五年', '近地铁']"
急降20W 房龄新 双南大两房 有钥匙 夫子庙 小区环境好,148,21311元/㎡,旭光里小区,秦淮,2,69.45㎡,南北,2018年建造,"['南北', '满五年', '近地铁']"
鼓楼区 二十 九中五塘地铁站 盛世花园 简装两房 生活方便,85,17595元/㎡,盛世花园,鼓楼,2,48.31㎡,南北,2000年建造,"['南北', '房东直卖', '满五年', '近地铁']"
C2双南户型 全湖景科技恒温住宅 朗诗绿色街区 随时看,150,16768元/㎡,朗诗绿色街区,雨花台,2,89.46㎡,南北,2013年建造,"['南北', '车位充足']"
0.5可以做 欢迎咨询低价 看房有钥匙 小区中间 阳光不挡,530,39382元/㎡,招商紫郡兰园,鼓楼,4,134.58㎡,南,2017年建造,"['南', '满二年', '近地铁', '绿化率高']"
中接费一口价9999 透明 公开 真实 拒绝差价 假一赔三,93,10725元/㎡,天润城第五街区,浦口,2,86.72㎡,南北,2010年建造,"['南北', '满五年', '近地铁', '车位充足']"
新城香溢紫郡 产权清晰 高楼层视野无遮挡 满五 南北通透,99.9,14205元/㎡,新城香溢紫郡,浦口,2,70.33㎡,南北,2015年建造,"['南北', '房东直卖', '满五年']"
华润国际社区 南北通透 交通便利 干净舒适 价格可聊,430,29862元/㎡,华润国际社区(三期),浦口,4,144㎡,南北,2019年建造,"['南北', '满二年', '次新房']"
报价急降40万 外地换房急售 满五 楼下地铁只要50米,130,11505元/㎡,润泰花园二期,浦口,3,113㎡,南北,2018年建造,"['南北', '满五年', '近地铁']"
0.5可以做 诚心卖房南师大，河海大学，山阴路，虎丘路，,430,80374元/㎡,虎丘路14号小区,鼓楼,2,53.5㎡,南北,1992年建造,"['南北', '满五年', '近地铁']"
栖园北苑 羊山湖金鹰位置好 叠加别墅 中间户 精装修,629,42977元/㎡,栖园,栖霞,3,146.36㎡,南北,2011年建造,"['南北', '满五年', '近地铁']"
急!急!急珍珠园91平南北急售看房随时,102,11209元/㎡,珍珠园,浦口,2,91㎡,南北,2000年建造,"['南北', '满二年']"
山潘四村三室一厅中间楼层南北通透房主诚心出售,115,15334元/㎡,山潘四村,六合,3,75㎡,南北,1993年建造,"['南北', '满五年', '近地铁']"
顶山，急售扬子江隧道口新江雅苑纯东边户89平万,106.3,11944元/㎡,新江雅苑,浦口,2,89㎡,南北,2017年建造,"['南北', '有电梯']"
招商雍宁府 精装修 雨山路地铁站 电梯花园洋房 随时看房,385,27113元/㎡,招商雍宁府,浦口,3,142㎡,南北,2020年建造,"['南北', '满二年', '近地铁', '车位充足']"
集庆门大街 润花园 4.8米挑高复式 电梯房住宅,145,32791元/㎡,润花园,建邺,1,44.22㎡,东,2018年建造,"['东', '满五年']"
东骏华府 楼层好 南北通透 带电梯 板楼 正规商品房,40,4089元/㎡,东骏华府(东区),六合,3,97.84㎡,南北,2015年建造,"['南北', '房东直卖', '满二年']"
左所雅苑 业主精装20万自住 楼层好 装修好 东西全留随时看,108,12273元/㎡,左所雅苑,浦口,2,88㎡,南北,2021年建造,"['南北', '满五年', '近地铁', '次新房']"
芳庭潘园 居家装修三房 地铁口 储藏室拎包入住 采光好,95,10556元/㎡,芳庭潘园,六合,3,90㎡,南北,2010年建造,"['南北', '满五年', '近地铁']"
新房龄电梯房 银江花园 简欧装修 全南户型 中间层 满五年,108,12935元/㎡,银江花园(六合),六合,2,83.5㎡,南北,2010年建造,"['南北', '房东直卖', '满五年']"
仁恒品质 洲岛家园悦江苑小高层两房 地铁十号线 诚售,155,26854元/㎡,洲岛家园悦江苑,建邺,2,57.72㎡,南北,2015年建造,"['南北', '满二年', '近地铁', '绿化率高']"
0.5可以做 欢迎电话咨询低价有钥匙 小区中间 阳光不挡,550,40881元/㎡,招商紫郡兰园,鼓楼,4,134.54㎡,南,2017年建造,"['南', '满二年', '近地铁', '绿化率高']"
北辰旭辉铂悦金陵 精装修3室2厅 南北通透 电梯房 急卖,550,55216元/㎡,北辰旭辉铂悦金陵,建邺,3,99.61㎡,南北,2018年建造,"['南北', '满二年', '近地铁', '车位充足']"
有电梯 满五 产权清晰 南向采光好 高楼层视野无遮挡,69,9453元/㎡,紫荆苑,江宁,2,73㎡,南,2012年建造,"['南', '满五年']"
南部新城 中间好楼层 南北通透 近医院 临地铁 配套齐全,125,24510元/㎡,阳光里小区,秦淮,2,51㎡,南北,1999年建造,"['南北', '满五年', '近地铁']"
南向采光好 交通便捷 有电梯 中间好楼层,65,10150元/㎡,麒麟紫荆城定林苑,江宁,2,64.04㎡,南,2000年建造,"['南', '满二年']"
装修好 南北通透 密度低 电梯房 高楼层视野无遮挡 双卫格局,618,48620元/㎡,升龙天汇珑尚,建邺,4,127.11㎡,南北,2000年建造,"['南北', '有电梯', '近地铁']"
全景东边户 20平入户阳台 方正大4房 满5且1 精装价可谈,330,19643元/㎡,翠屏国际城金榕苑,江宁,4,168㎡,南北,2012年建造,"['南北', '满五年', '近地铁', '绿化率高']"
双卫生间 超低密度 电梯房 有钥匙随时看房 满五 装修好,518,30484元/㎡,大地豪庭,秦淮,4,169.93㎡,南,2004年建造,"['南', '满五年', '绿化率高']"
保真 花2w入住新家 婚装三房 家具家电全留 江北新区旁,34,3778元/㎡,碧桂园欧洲城蝴蝶湾,南京周边,3,90㎡,南北,2019年建造,"['南北', '满二年', '次新房']"
板仓街49号2 双南诚心卖2004年房 总价低环境好,149,24427元/㎡,板仓街49号小区,玄武,2,61㎡,南北,2004年建造,"['南北', '近地铁']"
新上 S3贾西地铁口 福润雅居福润园 三房两厅 近超市菜场,137,12455元/㎡,福润雅居福润园,雨花台,3,110㎡,南北,2007年建造,"['南北', '满五年', '户型方正']"
高新朗诗居家大两房 南北通精装修 低总价 位置 全天阳光,118,17353元/㎡,朗诗未来街区(西区),浦口,2,68㎡,南北,2018年建造,"['南北', '满五年', '近地铁', '户型方正']"
满五 朝南 商业配套成熟 医疗配套成熟 近地铁 明厨明卫,110,19749元/㎡,兴贤佳园近贤苑,玄武,2,55.7㎡,南,2006年建造,"['南', '满五年', '近地铁']"
急急急 这是报价 还能再谈 润江城 江景143 顶楼,450,31379元/㎡,正荣润江城,浦口,4,143.41㎡,南,2010年建造,"['南', '满五年', '近地铁', '车位充足']"
近 楼层好 南北通透 精装修 商业配套齐全 即住,80,8248元/㎡,永欣新寓,江宁,2,97㎡,南北,2005年建造,"['南北', '满五年']"
急售急售 滨江西园 靠建宁路 大桥南路 双南 采光佳,118,20265元/㎡,滨江西园,鼓楼,2,58.23㎡,南北,1998年建造,"['南北', '满五年']"
必看地铁口 精装两房 无遮挡 湖景 双阳台 恒大金碧天下,43,5000元/㎡,恒大金碧天下,溧水,2,86㎡,南北,2019年建造,"['南北', '满五年', '次新房']"
紫杨佳园 南向采光好 商业配套成熟 板楼 低容积,110,15493元/㎡,紫杨佳园,秦淮,2,71㎡,南,2017年建造,"['南', '有电梯', '采光较好']"
难有的边户 1梯2户 方正大4房 精装保养新 满5且1 车位,330,22603元/㎡,翠屏国际城广场苑,江宁,4,146㎡,南北,2012年建造,"['南北', '满五年', '近地铁', '绿化率高']"
盘福雅苑大两房 南北通透 精装修 楼层好 采光刺眼 诚心卖,90,9791元/㎡,盘福雅苑,浦口,2,91.93㎡,南,2021年建造,"['南', '有电梯', '次新房']"
禄口天花板 不得了不得了 线啦 165加,173,14603元/㎡,奥园金基天著尚居,江宁,4,118.47㎡,南北,2020年建造,"['南北', '房东直卖', '有电梯', '绿化率高']"
爱涛科技房 5号 位置 大三房两卫中楼层 诚售 青山湾花园,245,20480元/㎡,爱涛尚逸华府,江宁,3,119.63㎡,南北,2012年建造,"['南北', '满五年']"
总价低 房主急售 天润城第六街区 地铁口 南北通透 三房两卫,125,10493元/㎡,天润城第六街区,浦口,3,119.13㎡,南北,2008年建造,"['南北', '满五年', '近地铁', '车位充足']"
怡景佳园 64平 26万 公办南外和三甲医院 好楼层,26,4063元/㎡,怡景佳园(溧水),溧水,2,64㎡,南北,2018年建造,"['南北', '满二年', '近地铁', '户型方正']"
宝驰景秀苑(北区) 楼层好 满二 精装可拎包入住 近地铁,89,8900元/㎡,宝驰景秀苑(北区),滨江开发区,3,100㎡,东,2012年建造,"['东', '满二年']"
大四房两卫楼层好位置好，全屋中央空调看房方便,205,14643元/㎡,南京碧桂园逸谷苑,滨江开发区,4,140㎡,南北,2018年建造,"['南北', '满二年', '户型方正']"
恒信珑湖国际 101平大三房湖景房 视野好 无遮挡 临地铁,128,12674元/㎡,恒信珑湖国际,滨江开发区,3,101㎡,南北,2017年建造,"['南北', '满五年']"
扬子四村 2楼 居家两室 保养好 配套扬一,63,11053元/㎡,扬子四村,六合,2,57㎡,南北,1990年建造,"['南北', '满五年']"
新上 青青家园 康居园旁 新民花苑 中套六楼带阁楼 68万,68,7158元/㎡,新民花苑,滨江开发区,2,95㎡,南北,2008年建造,"['南北', '满二年']"
御珑湾 精装可拎包入住 南北通透 中间好楼层 临地铁,99,12703元/㎡,御珑湾,六合,2,77.94㎡,南北,2016年建造,"['南北', '满二年', '近地铁', '车位充足']"
户型方正，楼层好，满五年，诚心出售，有钥匙看房方便,130,11909元/㎡,华汇康城,江宁,3,109.17㎡,南北,2016年建造,['南北']
地铁口 大二房 南北通透 拎包入住 看房方便 诚心卖,93.8,10901元/㎡,海润枫景花园,浦口,2,86.05㎡,南北,2010年建造,"['南北', '满五年', '近地铁']"
东虹花苑北苑 采光好 位置好 双地铁 拎包入住 首付二成,110,15278元/㎡,东虹花苑北苑,滨江开发区,2,72㎡,南,2017年建造,"['南', '满二年', '户型方正']"
玄武13中 六号线口 修贤苑南北俩房,118,18154元/㎡,兴贤佳园修贤苑,玄武,2,65㎡,南北,2008年建造,"['南北', '满五年', '近地铁']"
地铁口，豪华装修拎包入住，碧桂园凤凰城，业主换房子，诚心出售,37,4187元/㎡,碧桂园凤凰城凤鸣苑,南京周边,2,88.37㎡,南北,2014年建造,"['南北', '满五年']"
中南园 临地铁 医疗配套成熟 交通便捷 电梯房 商业配套齐全,90,14956元/㎡,中南园,鼓楼,1,60.18㎡,东南,1998年建造,"['东南', '满五年', '多人关注']"
河西金鹰 精装修 中楼层三房 价格有空间,159,26602元/㎡,湖西村,建邺,3,59.77㎡,南,1991年建造,"['南', '满五年', '近地铁']"
荣盛莉湖春晓 房龄新 精装好房 板楼 产权清晰 商业配套成熟,86,11316元/㎡,荣盛莉湖春晓,六合,2,76㎡,南北,2014年建造,"['南北', '近地铁']"
