标题,总价（万）,单价,小区,区域,房间数,大小,朝向,建造时间,标签
正南朝向 产权清晰 出行方便 电梯房 满二 高楼层视野无遮挡,250,26871元/㎡,弘阳燕江府,栖霞,3,93.04㎡,南,2018年建造,"['南', '满二年', '户型方正']"
扬子一村 小三居 中间楼层 近扬子一中 靠经久菜场 二村菜场,78,10130元/㎡,扬子一村,六合,3,77㎡,南北,1992年建造,"['南北', '满二年']"
南北通透 精装好房 低密度社区 带电梯 高楼层视野无遮挡,235,28314元/㎡,云谷山庄,鼓楼,3,83㎡,南北,2011年建造,"['南北', '房东直卖', '有电梯', '近地铁']"
迈皋桥核心（无费用）优惠力度大 车接车 来电享优惠 专属,278,31236元/㎡,金浦御龙湾,栖霞,2,89㎡,南,,"['南北通透', '厨卫全明', '动静分离', '多轨交']"
新城璞樾钟山 次新房 南向采光好 交通便捷 双卫生间 商品房,499,36262元/㎡,新城璞樾钟山,栖霞,3,137.61㎡,南,2019年建造,"['南', '满二年', '近地铁', '次新房']"
九龙湖次新房万科金域蓝湾精装修3房保养好诚心出售,339,29610元/㎡,万科金域蓝湾,江宁,3,114.49㎡,南北,2018年建造,"['南北', '房东直卖', '满二年', '近地铁']"
金阜雅苑 正规商品房 交通便捷 中间好楼层 近医院,266,34904元/㎡,金阜雅苑,鼓楼,2,76.21㎡,南北,2013年建造,['南北']
内部特价打骨折 雨核贾西地铁口 高端品质尊享 免费看房车,396,40000元/㎡,建发璞云,雨花台,3,99㎡,南,,"['大阳台', '客厅朝南', '购物中心']"
仙林湖保利罗兰香谷 近双地铁 金中金小 省中医院,204,23182元/㎡,保利罗兰香谷,栖霞,3,88㎡,南北,2018年建造,"['南北', '满二年', '近地铁', '户型方正']"
中海玄武公馆次新房，小区环境优美，业主诚意出售，价格好谈,410,42448元/㎡,中海玄武公馆B区,玄武,3,96.59㎡,南,2018年建造,"['南', '南北通透', '配套成熟', '房东急售']"
急售，急售 临地铁 次新小区 南北通透 精装可拎包入住,109,12270元/㎡,威尼斯水城第十九街区,浦口,2,88.84㎡,南北,2019年建造,"['南北', '满二年', '次新房']"
随时看房 燕子矶 燕江新城新小区 低总价三房 业主急售,128,14485元/㎡,燕江新城燕归苑,栖霞,3,88.37㎡,南北,2017年建造,"['南北', '唯一住房']"
3.5万起！买南部新城，还是精装修！,370,35239元/㎡,禧樾府,江宁,3,105㎡,南北,,['多轨交']
有电梯 停车方便 精装好房 刚需小三居 商业配套成熟 临地铁,188,20216元/㎡,中南世纪雅苑二期,栖霞,3,93㎡,南,2019年建造,"['南', '有电梯', '车位充足']"
必看好房！瑞北1中！1楼带院子！小区C位！采光好！随时看,255,44310元/㎡,瑞金北村(35-69幢),秦淮,3,57.55㎡,南,1990年建造,"['南', '满五年', '近地铁']"
华府国际四期 急降15W 三房两卫 业主急售 看中可谈,180,17515元/㎡,华府国际,浦口,3,102.77㎡,南,2017年建造,"['南', '满二年', '多人关注']"
直降70w 出价就卖 房东急售 带车位！有钥匙随时看,250,26701元/㎡,高科荣境2期,栖霞,3,93.63㎡,南北,2020年建造,"['南北', '热门小区', '房东急售', '随时可看']"
急急急售 房东直降70万 融信世纪东方 双地铁 车位,252,25414元/㎡,融筑儒林花园,栖霞,3,99.16㎡,南北,2019年建造,"['南北', '满二年', '近地铁', '车位充足']"
急卖 精园 三房两厅 万达商圈 地铁口 有钥匙,263,29551元/㎡,精金花园,建邺,3,89㎡,南北,2017年建造,"['南北', '热门小区', '房东急售', '随时可看']"
相信独具慧眼的您会 一套超值低价,375,32895元/㎡,御道嘉庭,秦淮,3,114㎡,南北,2021年建造,"['南北', '价格优惠', '房东急售']"
软件谷 南京产业之城的核心 成熟配套 资源荟萃也要高颜值设计,408,40800元/㎡,保利合肥城建·凤起云台,雨花台,3,100㎡,南,,"['南北通透', '三房朝南', '双阳台', '轨交房']"
诺家优选 银城汇文 低总价两房 小区中间位置 采光无遮挡！,338,50448元/㎡,育才公寓(西片),鼓楼,2,67㎡,南,2000年建造,"['南', '满五年']"
南北通透 商业配套成熟丁家 庄燕舞园 交通便利,149,16446元/㎡,燕舞园,栖霞,3,90.6㎡,南北,2014年建造,"['南北', '满五年', '近地铁']"
29 场门口 清凉门 房龄新 带花园 空间大,328,64377元/㎡,场门口14号小区,鼓楼,2,50.95㎡,南,1990年建造,"['南', '新上小区', '南北通透', '房东急售']"
西流湾 一楼带60平拐角大院子已开门 全明东边户 阳光不挡,298,33623元/㎡,西流湾38-40号双号小区,鼓楼,3,88.63㎡,南北,1995年建造,"['南北', '新上小区', '价格优惠', '随时可看']"
专属团购优惠 车接车,298,33484元/㎡,颐居华发 颐和四季府,栖霞,3,89㎡,南,,"['南北通透', '厨卫全明', '主卧套房', '车位充足']"
花语城中苑 毛坯3房总房价低102万 湖景房随时看,102,11378元/㎡,荣盛花语城(三期),六合,3,89.65㎡,南北,2000年建造,"['南北', '满二年']"
河西南 鱼背豪华四房 天鹅堡花园 新空未入住 有钥匙诚售,650,40124元/㎡,华侨城天鹅堡,建邺,4,162㎡,南,2020年建造,"['南', '有电梯', '近地铁', '次新房']"
燕子矶融创高品质低总价88平双卫小三室精装交付有地暖保养如新,292,32924元/㎡,融创玉兰公馆一期,栖霞,3,88.69㎡,南北,2019年建造,"['南北', '热门小区', '价格优惠', '房东急售']"
四线地铁，立体路网，自建,327,28435元/㎡,中交锦度(新房),浦口,3,115㎡,南,,"['南北通透', '厨卫全明', '双卫生间', '车位充足']"
地铁口满五 有电梯 高楼层 视野无遮挡 近医院 商业配套成熟,123,17827元/㎡,天润城第十一街区(南区),浦口,2,69㎡,南,2011年建造,"['南', '满五年', '近地铁']"
新上直降100W！ 仙林湖金中金小 融信世纪东方 次新房小区,244,24501元/㎡,融筑儒林花园,栖霞,3,99.59㎡,南,2018年建造,"['南', '热门小区', '近地铁', '房东急售']"
急急急！带产权车位！降价70万！自住装修！！,210,22164元/㎡,万达茂御湖仕家二期,栖霞,3,94.75㎡,南北,2015年建造,"['南北', '满五年', '近地铁']"
扬子二村三楼精装修暖气房,60,11651元/㎡,扬子二村,六合,2,51.5㎡,南北,1990年建造,"['南北', '唯一住房']"
总价350万起 铁心桥 伟星时代悦峰 景明佳园地铁口 优惠大,420,40385元/㎡,伟星·时代悦峰,雨花台,3,104㎡,南,,"['双阳台', '客餐厅相连', '客厅朝南', '轨交房']"
竹山路武夷绿洲品兰苑 南北通透电梯大两房 中间楼层 年底急售,230,23268元/㎡,武夷绿洲品兰苑,江宁,2,98.85㎡,南北,2010年建造,"['南北', '满五年', '近地铁']"
豪装40万 经典3开间朝南房 视野采光好 小区中心位置,140,16280元/㎡,威尼斯水城第十六街区,浦口,2,86㎡,南北,2019年建造,"['南北', '满五年', '次新房', '户型方正']"
雨花区 板桥 吾悦广场旁 绿洲南苑 大三房 房东诚心出售,78,9741元/㎡,绿洲南苑C区,雨花台,3,80.08㎡,南北,2000年建造,"['南北', '满二年']"
中海左岸澜庭 二次装修 业主急卖 价格可谈 看房联系HXY,250,25576元/㎡,中海左岸澜庭,浦口,3,97.75㎡,南,2021年建造,"['南', '热门小区', '近地铁', '南北通透']"
拒绝虚假 紫金山脚下电梯入户四层170平大平层 视野非常好,568,33412元/㎡,保利紫晶山,栖霞,4,170㎡,南,2013年建造,"['南', '热门小区', '近地铁', '配套成熟']"
老业主诚售 价可谈 小区低 随时看 拎包入住,238,33812元/㎡,万达西地,建邺,2,70.39㎡,南北,2010年建造,"['南北', '热门小区', '房东急售', '随时可看']"
安个家 专注油坊桥 小区专家 咨询更多 房,165,18685元/㎡,莲花新城嘉园,建邺,3,88.31㎡,南,2012年建造,"['南', '满二年', '近地铁']"
雨山路地铁口.220万起！10号线地铁直达河西！随时看房,270,27000元/㎡,龙湖天曜城,浦口,3,100㎡,南,,"['轨交房', '车位充足']"
标题,总价（万）,单价,小区,区域,房间数,大小,朝向,建造时间,标签
急售，工作调动，看好大胆出价，房东愿意低价出售,300,26065元/㎡,融筑儒林花园,栖霞,3,115.1㎡,南北,2019年建造,"['南北', '满五年', '近地铁', '车位充足']"
楼层好 居住密度低 钥匙房 满五,320,34240元/㎡,鑫园小区,秦淮,3,93.46㎡,南,2002年建造,"['南', '满五年']"
弘阳禹洲时光印象 商品房 交通便捷 电梯房 近地铁 南北通透,86,9713元/㎡,弘阳禹洲时光印象,滨江开发区,3,88.55㎡,南北,2019年建造,"['南北', '近地铁', '价格优惠', '房东急售']"
尊荣典范 成功象征 豪宅标配会所 超大绿化空间 单价低至3万,350,32111元/㎡,保利·燕璟和颂,栖霞,3,109㎡,南,,"['动静分离', '户型方正', '多轨交', '车位充足']"
珍珠雅苑 近地铁 商圈成熟 南北通透 小三居 板楼 楼层好,110,12088元/㎡,珍珠雅苑,浦口,3,91㎡,南北,2018年建造,"['南北', '满二年']"
中医院旁碧桂园洋房 二次装修 带新风 地暖 有产权车位,168,14609元/㎡,南京碧桂园浅山苑,滨江开发区,3,115㎡,南北,2018年建造,"['南北', '满二年']"
"福建路两房有电梯,三牌楼商圈生活便利 交通发达",145,20852元/㎡,钟阜大厦,鼓楼,2,69.54㎡,南,2018年建造,"['南', '满五年']"
央企独资开发 豪宅标配会所 超大绿化空间 高定位装标,320,32324元/㎡,保利·燕璟和颂,栖霞,3,99㎡,南,,"['多轨交', '车位充足']"
新上！直降50万急售 业主装修40万 金中金小 双地铁,423,35718元/㎡,融筑儒林花园,栖霞,3,118.43㎡,南北,2020年建造,"['南北', '近地铁', '车位充足']"
中海玄武公馆次新房，小区环境优美，业主诚意出售，价格好谈,410,42448元/㎡,中海玄武公馆B区,玄武,3,96.59㎡,南,2018年建造,"['南', '南北通透', '配套成熟', '房东急售']"
215w降价诚售 燕子矶 南师 看房方便 配套成熟交通便利,215,24690元/㎡,海赋尚城一期,栖霞,3,87.08㎡,南,2018年建造,"['南', '满五年', '近地铁']"
315W 急 仅有一套 随时看 软件大道 精装 小行 近河西,329,37167元/㎡,中南锦苑,雨花台,3,88.52㎡,南,2017年建造,"['南', '房东直卖', '满五年', '近地铁']"
年底8折江北核心区，准现房，地铁口,403,34153元/㎡,中海观江樾,浦口,3,118㎡,南,,"['大户型', '轨交房', '车位充足']"
栖霞区仙林湖融信世纪东方3室2厅,276,30742元/㎡,融筑儒林花园,栖霞,3,89.78㎡,南,2020年建造,"['南', '满二年', '近地铁', '车位充足']"
融信世纪东方三房 急售 金小金中 二号线四号线 万达茂商业,218,24589元/㎡,融筑儒林花园,栖霞,3,88.66㎡,南北,2018年建造,"['南北', '满五年', '近地铁', '车位充足']"
莲花新城嘉园 交通便捷 高楼层视野好 满二 小三房 临地铁,170,19102元/㎡,莲花新城嘉园,建邺,3,89㎡,南,2013年建造,"['南', '满二年', '近地铁']"
近地铁 产权清晰 有电梯 精装可拎包入住 小区新 正南朝向,310,30694元/㎡,中海燕矶听潮A区,栖霞,3,101㎡,南,2017年建造,"['南', '房东急售']"
宋都旁 金地2期 精装全南三房 两厅一卫采光无挡 满5 力小,112,15489元/㎡,金地自在城(二期),雨花台,3,72.31㎡,南北,2000年建造,"['南北通透', '价格优惠', '房东急售']"
江南名府 多层3楼 楼层好 采光充足 配套齐全 交通便利,398,33965元/㎡,江南名府,建邺,3,117.18㎡,南北,2018年建造,"['南北', '满五年']"
碧桂园逸谷苑 三房两卫150万房东急售 全新房7楼视野开阔,153,13077元/㎡,南京碧桂园逸谷苑,滨江开发区,3,117㎡,南北,2017年建造,"['南北', '房东直卖', '满二年']"
城北新街口，燕子矶门户，双地铁1号7号线 ，双阳台横厅设计,330,33334元/㎡,保利·国贸璟上,栖霞,3,99㎡,南北,,"['多轨交', '车位充足']"
急卖！中间楼层 85平小三房 价格好谈,88,10353元/㎡,摄山星城听竹苑,栖霞,3,85㎡,南北,2006年建造,"['南北', '满五年', '绿化率高', '户型方正']"
~次新毛坯系 湖南路 地铁口 绿地紫金中心 边户 急售,689,49655元/㎡,绿地紫金中心,鼓楼,3,138.76㎡,南北,2019年建造,"['南北', '有电梯', '近地铁', '次新房']"
直降70w 出价就卖 房东急售 带车位！有钥匙随时看,250,26701元/㎡,高科荣境2期,栖霞,3,93.63㎡,南北,2020年建造,"['南北', '热门小区', '房东急售', '随时可看']"
急售！降价四十万！仙龙湾南北通透两房 南师 仙林学则路,278,30333元/㎡,仙龙湾山庄,栖霞,2,91.65㎡,南北,2015年建造,"['南北', '满五年', '近地铁']"
330万可购 软件大道 雨核 精装 地铁口 免费车接看房,370,37374元/㎡,万科朗拾雨核,雨花台,3,99㎡,南,,"['南北通透', '大阳台', '双卫生间', '购物中心']"
高楼层采光充足 小三居 正南朝向 有电梯 近地铁 正规商品房,288,29388元/㎡,金地风华国际,浦口,3,98㎡,南,2021年建造,"['南', '有电梯', '车位充足', '户型方正']"
小区靠前位置，无遮挡，诚心出售，看房随时,178,25986元/㎡,万科金色里程,雨花台,2,68.5㎡,南北,2008年建造,"['南北', '满五年', '近地铁']"
"板桥，弘阳春 西江经典开间,精装修经典户型,随时看房",120,13740元/㎡,弘阳春上西江,雨花台,3,87.34㎡,南,2017年建造,"['南', '满二年']"
新街口商圈， ，现房，七大科技系统,318,53000元/㎡,香港置地·金陵中環,秦淮,1,60㎡,南北,,['多轨交']
急售湖景房 金中金小 中间楼层 双地铁4号2号 价格可谈,203.5,21198元/㎡,万达茂御湖仕家三期,栖霞,3,96㎡,南北,2018年建造,"['南北', '满二年', '近地铁', '采光较好']"
29 场门口 清凉门 房龄新 带花园 空间大,328,64377元/㎡,场门口14号小区,鼓楼,2,50.95㎡,南,1990年建造,"['南', '新上小区', '南北通透', '房东急售']"
江北核心区中海左岸澜庭，房东诚心卖，房东急售急售,265,27094元/㎡,中海左岸澜庭,浦口,3,97.81㎡,南,2021年建造,"['南', '唯一住房', '近地铁', '车位充足']"
万科金域蓝湾精装3房户型正采光好价格可谈看房方便随时约,275,32228元/㎡,万科金域蓝湾,江宁,3,85.33㎡,南北,2013年建造,"['南北', '满五年', '近地铁']"
看我 来电享团购特价7折起 年终数量有限 江北核中核龙湖 棒,359,31770元/㎡,龙湖·天璞,浦口,3,113㎡,南,,"['南北通透', '厨卫全明', '主卧套房', '车位充足']"
安泰村 3楼 省二中旁 7号线地铁口 大客厅 南北两房满五年,198,25715元/㎡,安泰小区,建邺,2,77㎡,南,1992年建造,"['南', '近地铁']"
河西南 朗诗熙华府 性价比超高 随时看 诚心出 科技住房,585,36659元/㎡,朗诗熙华府,建邺,3,159.58㎡,南北,2018年建造,"['南北', '满二年', '近地铁', '车位充足']"
桥北 精装修三房 医疗配套成熟 有电梯 高楼层视野好,102,11820元/㎡,江岸水城,浦口,2,86.3㎡,南北,2015年建造,"['南北', '有电梯', '近地铁', '绿化率高']"
新上直降100W！ 仙林湖金中金小 融信世纪东方 次新房小区,244,24501元/㎡,融筑儒林花园,栖霞,3,99.59㎡,南,2018年建造,"['南', '热门小区', '近地铁', '房东急售']"
双阳台 落地窗 不靠高速 新都雅苑 中 楼层 业主急售,135,12858元/㎡,城开新都雅苑(一期),六合,3,105㎡,南北,2016年建造,"['南北', '近地铁', '车位充足']"
高新区 蓝海雅苑A区 板楼 南北通透 次新房 小三居 临地铁,120,13187元/㎡,蓝海雅苑(A区),浦口,3,91㎡,南北,2019年建造,"['南北', '有电梯', '近地铁', '次新房']"
海赋尚城一期 产权清晰 购物方便 南向采光好 交通便捷,245,24929元/㎡,海赋尚城一期,栖霞,3,98.28㎡,南,2018年建造,"['南', 'VIP房东直卖', '满五年', '近地铁']"
江北核心区 开发商降价100万 出售 今年的市场可遇不可求,403,35983元/㎡,晴翠府,浦口,3,112㎡,南,,"['南北通透', '厨卫全明', '主卧套房', '车位充足']"
标题,总价（万）,单价,小区,区域,房间数,大小,朝向,建造时间,标签
仙林湖 高科荣境精装修带院子 品质洋房小区 居住舒适,287,31048元/㎡,高科荣境2期,栖霞,3,92.44㎡,南,2015年建造,"['南', '满五年', '近地铁', '多人关注']"
高科二期一楼带院子 业主自住装修 全屋品牌家具家电随时可,305.5,33096元/㎡,高科荣境2期,栖霞,3,92.31㎡,南,2015年建造,"['南', '满五年', '近地铁', '户型方正']"
假一罚百 星雨华府 2号线地铁口 大两房 中高楼层 业主诚心,400,43692元/㎡,星雨华府,建邺,2,91.55㎡,南北,2008年建造,"['南北', '满五年', '近地铁', '绿化率高']"
尊荣典范 成功象征 豪宅标配会所 超大绿化空间 单价低至3万,350,32111元/㎡,保利·燕璟和颂,栖霞,3,109㎡,南,,"['动静分离', '户型方正', '多轨交', '车位充足']"
南北通透 装修好 中间好楼层 低容积 房东急置换 诚意买房,338,31887元/㎡,星河翠庭,鼓楼,3,106㎡,南北,2000年建造,"['南北', '近地铁']"
新上云谷山庄 精装边户三房 凤凰楼层 小区 急售全明,245,27529元/㎡,云谷山庄,鼓楼,3,89㎡,南北,2011年建造,"['南北', '近地铁', '绿化率高']"
花园洋房 江雁依山郡 精装两房 采光好 近7号线地铁口,245,27841元/㎡,江雁依山郡,鼓楼,2,88㎡,南,2000年建造,"['南', '近地铁']"
央企独资开发 豪宅标配会所 超大绿化空间 高定位装标,320,32324元/㎡,保利·燕璟和颂,栖霞,3,99㎡,南,,"['多轨交', '车位充足']"
中海玄武公馆B区 临地铁 板楼 刚需小三居 交通便捷,410,42474元/㎡,中海玄武公馆B区,玄武,3,96.53㎡,南北,2018年建造,"['南北', '有电梯', '近地铁', '车位充足']"
大厂地铁口 阿尔卡好楼层 位置安静 采光非常好 大三房,170,12875元/㎡,荣盛水景城天枢苑,六合,3,132.04㎡,南北,2010年建造,"['南北', '近地铁', '配套成熟']"
带电梯 朝南 出行方便 房龄新 双卫格局 临地铁 动静分离,440,36907元/㎡,升龙天汇珑臺,建邺,3,119.22㎡,南,2018年建造,"['南', '热门小区', '近地铁', '优势户型']"
仙林湖金地东边户 南北通透热销户 新空房未住过 金小金中,200,20459元/㎡,金地湖城艺境,栖霞,3,97.76㎡,南,2015年建造,"['南', '满五年', '近地铁', '采光较好']"
年底8折江北核心区，准现房，地铁口,403,34153元/㎡,中海观江樾,浦口,3,118㎡,南,,"['大户型', '轨交房', '车位充足']"
急急急！业主挥泪急售 装修30万 价格可谈 随时看房,200,22556元/㎡,新城香悦澜山,栖霞,3,88.67㎡,南北,2017年建造,"['南北', '满五年', '近地铁', '多人关注']"
融筑儒林花园 板楼 次新小区 装修好 南北通透 小三房,214,24242元/㎡,融筑儒林花园,栖霞,3,88.28㎡,南北,2019年建造,"['南北', '满二年', '近地铁', '车位充足']"
看房有钥匙 高楼层采光充足 南北通透 低密宜居,242,29052元/㎡,江雁依山郡,鼓楼,3,83.3㎡,南北,2000年建造,"['南北', '房东直卖', '近地铁', '户型方正']"
双地铁口 五塘小市金域中央 精装3房 楼层好景观房 南北通透,326,29637元/㎡,金域中央街区1,鼓楼,3,110㎡,南北,2010年建造,"['南北', '热门小区', '近地铁', '优势户型']"
近地铁 产权清晰 有电梯 精装可拎包入住 小区新 正南朝向,310,30694元/㎡,中海燕矶听潮A区,栖霞,3,101㎡,南,2017年建造,"['南', '房东急售']"
高科荣境2期 有电梯 中间好楼层 装修好 板楼 南北通透,301,32370元/㎡,高科荣境2期,栖霞,3,92.99㎡,南北,2018年建造,"['南北', '满二年', '近地铁']"
升龙天汇 精装三房 新空未入住 有钥匙随时看房 满2年急售,390,39394元/㎡,升龙天汇珑尚,建邺,3,99㎡,南,2018年建造,"['南', '满五年', '近地铁', '多人关注']"
城北新街口，燕子矶门户，双地铁1号7号线 ，双阳台横厅设计,330,33334元/㎡,保利·国贸璟上,栖霞,3,99㎡,南北,,"['多轨交', '车位充足']"
直降70w 出价就卖 房东急售 带车位！有钥匙随时看,250,26701元/㎡,高科荣境2期,栖霞,3,93.63㎡,南北,2020年建造,"['南北', '热门小区', '房东急售', '随时可看']"
29 场门口 清凉门 房龄新 带花园 空间大,328,64377元/㎡,场门口14号小区,鼓楼,2,50.95㎡,南,1990年建造,"['南', '新上小区', '南北通透', '房东急售']"
朗诗未来街区 二房朝南 南北通透 超新装修 满五 急售,168,18877元/㎡,朗诗未来街区(东区),浦口,3,89㎡,南北,2018年建造,"['南北', '热门小区', '新上小区', '配套成熟']"
朗诗未来街区精装三房满五 家具家电中 楼层近地铁价格可谈,140,15731元/㎡,朗诗未来街区(东区),浦口,3,89㎡,南北,2019年建造,"['南北', '满五年', '近地铁', '次新房']"
330万可购 软件大道 雨核 精装 地铁口 免费车接看房,370,37374元/㎡,万科朗拾雨核,雨花台,3,99㎡,南,,"['南北通透', '大阳台', '双卫生间', '购物中心']"
新上直降100W！ 仙林湖金中金小 融信世纪东方 次新房小区,244,24501元/㎡,融筑儒林花园,栖霞,3,99.59㎡,南,2018年建造,"['南', '热门小区', '近地铁', '房东急售']"
小区新 有电梯 精装修 有钥匙随时看房 高楼层视野无遮挡,350,39331元/㎡,招商雍和府,建邺,3,88.99㎡,南北,2018年建造,"['南北', '有电梯', '近地铁']"
融创玉兰公馆一期 南北通透 双卫 商圈成熟 正规商品房 满二,305,33984元/㎡,融创玉兰公馆一期,栖霞,3,89.75㎡,南北,2018年建造,"['南北', '满二年', '车位充足']"
新街口商圈， ，现房，七大科技系统,318,53000元/㎡,香港置地·金陵中環,秦淮,1,60㎡,南北,,['多轨交']
融筑儒林花园90.32平298万3室2厅1卫,313,34655元/㎡,融筑儒林花园,栖霞,3,90.32㎡,南北,2018年建造,"['南北', '满二年', '近地铁', '车位充足']"
急卖 单价1万买花语城三房 好楼层 采光好 北小科利华 可谈,102,11466元/㎡,荣盛花语城(四期),六合,3,88.96㎡,南,2019年建造,"['南', '热门小区', '近地铁', '配套成熟']"
中海左岸澜庭 二次装修 业主急卖 价格可谈 看房联系HXY,250,25576元/㎡,中海左岸澜庭,浦口,3,97.75㎡,南,2021年建造,"['南', '热门小区', '近地铁', '南北通透']"
三十平大院 三房 一楼 秦虹 边户 240万总价低 有钥匙,240,33942元/㎡,旭光里小区,秦淮,3,70.71㎡,南北,1990年建造,"['南北', '满五年', '近地铁']"
看我 来电享团购特价7折起 年终数量有限 江北核中核龙湖 棒,359,31770元/㎡,龙湖·天璞,浦口,3,113㎡,南,,"['南北通透', '厨卫全明', '主卧套房', '车位充足']"
亲，我这里什么都没有，只有好房，而您买的只有幸福,290,31618元/㎡,龙湖春江紫宸,鼓楼,3,91.72㎡,南,2000年建造,"['南', '满二年']"
招商依云郡 小区新 满二 高楼层采光充足 带电梯 正南朝向,107,12454元/㎡,招商依云郡,江宁,3,85.92㎡,南,2017年建造,"['南', '热门小区', '近地铁', '配套成熟']"
地铁口 精装20万 边户全明 低总价 急售 急售,132,14832元/㎡,燕江新城燕归苑,栖霞,3,89㎡,南,2017年建造,"['南', '热门小区', '价格优惠', '房东急售']"
大行宫总统府 有电梯 有加盖 全明 小区中间 太平桥南,218,36129元/㎡,裕德里小区,玄武,3,60.34㎡,南,1992年建造,"['南', '优势户型', '房东急售', '随时可看']"
金科博翠花园 高楼层视野好 车位充足 环境好 商品房 精装修,322,34256元/㎡,金科博翠花园,栖霞,3,94㎡,南,2020年建造,"['南', '满二年', '绿化率高']"
熙悦(一期) 小三居 中间楼层采光好 车位充足 交通便捷,200,22787元/㎡,熙悦(一期),江宁,3,87.77㎡,南,2019年建造,"['南', '热门小区', '价格优惠', '房东急售']"
急售精装40万，急降60万，双地铁，带产权车位，飞机户型,287,24234元/㎡,融筑儒林花园,栖霞,3,118.43㎡,南北,2018年建造,"['南北', '满五年', '近地铁', '车位充足']"
江北核心区 开发商降价100万 出售 今年的市场可遇不可求,403,35983元/㎡,晴翠府,浦口,3,112㎡,南,,"['南北通透', '厨卫全明', '主卧套房', '车位充足']"
三开间朝南低密度洋房 7号线地铁口 飞机户型 得房率高 满二,389.9,39616元/㎡,万象天地九悦(东区),栖霞,3,98.42㎡,南北,2021年建造,"['南北', '热门小区', '配套成熟', '价格优惠']"
258万元 朝南朝向，此房只应天 有!人间难得见一回啊！,258,28591元/㎡,亚东城(东区),栖霞,2,90.24㎡,南,2000年建造,"['南', '满二年', '近地铁', '绿化率高']"
急！大刀 价格给力哦！精装电梯 大三房 随时看房 虹悦城,425,34731元/㎡,凤凰和美,雨花台,3,122.37㎡,南北,2010年建造,"['南北', '房东急售']"
新上南部新城 精装3房抄底了 急降70W随时看房老业主太便宜,305,32136元/㎡,保利堂悦,秦淮,3,94.91㎡,南北,2018年建造,"['南北', '满五年', '近地铁', '多人关注']"
燕子矶新城 栖霞建设燕尚玥府 全系横厅 精装交付,409,34084元/㎡,星叶燕尚玥府,栖霞,4,120㎡,南北,,"['大户型', '购物中心']"
世茂外滩新城 毛坯两房 户型方正 高楼层 出售,350,31658元/㎡,世茂外滩新城,鼓楼,2,110.56㎡,南北,2017年建造,"['南北', '满二年', '绿化率高', '多人关注']"
